{"artifact_digests":{"artifact.00448f0fecd9a53bedafa206":"ec734d74585e662b8792f5bb5386c0b8da04b0ad417ca4c63c8313e114364149","artifact.01b45e6a03688174cfe261da":"511dd68e892f090e6b85c4d46ed91485da76479dc8f3d0ea75bf31428e0aa7b0","artifact.01d4a6b772e8c349bedc0e51":"f968544a026dcce6a36d0d48cc2281301e23c83499a014dcd1f806071ff5900b","artifact.0205385753b2c24d4e32496f":"77e6520c26aa61381f7e433a84015a46b29666d30e34ac2c1b64e15729906116","artifact.028559ba73ba310abcd32cce":"6e15e2fded266a51e5acf112e4b40d1a2c020525edb296146ab03db1aac70179","artifact.045bdb506fc8c0d0a56fffcd":"fc75649abeff6caf8231ee3c11343edaccc8aba8aa215b93c05d432fef880bee","artifact.050b0b0bf9fe43046e1d5abd":"f4ed770965c9db8c9aa6fa7eb71b9dac34db71cb709e53c52a4a215297903d76","artifact.05cd12bcb9fa3ce98cf661ec":"a5f0559f993bd6ef00b80227db43a6c17f46e38a9d15abdefe76d8d576db652e","artifact.0610cf82bc99c84ad1a3a9bd":"c16054b6fce831492d6a315ed5ec20978408ab9196f9ff389954259061b352a6","artifact.0b4374d3870a6eba63a01c3b":"efc2e644e188a719ca759c5bfa23bb1c5153438c45b4e55d4b26cbc106625a7e","artifact.0b99c56fe6208731ba32485d":"3f17d13fb3677ed1cd19fe06ad584b192c533e53d3d7c2a5d201f7404628e810","artifact.0c071b09b207373b986e19c0":"4a541f76c100e94d141a58a3a4545959a1283bf6141fd20bf6a199f0d07a883d","artifact.0f70c375420cd832964062c5":"aec5dbd90a3c6ca1a70f7ec6cca8f6bf7740142280ccc0e5f7f2b2d14170451f","artifact.11db8d3b16c2d008d3693150":"538a8875cf30998efce851dd984195230d936e28ca8c997dda77be1d10dbc9d0","artifact.132b584cef98ed9fb6bde95c":"dddba224484cd0fc60664aa404c2e30b842eb0e8d883b0953a7fed77e99abff3","artifact.14ed313c2600140717df2933":"f073d5fccee6d12d280fcf8a48913d65e00f7f7b155fe14bf0ae1487da392995","artifact.151527aff313cf5399693e9a":"fe61cb03bec926777dfce82cbd619c373501374a6f308e83fe463c9c9238957c","artifact.15c4c4f22e7bf46b0ccc7350":"c991d64d3431b01fb61055441762e861628e4e6e4028441d0a6abe0cb05fa64a","artifact.17c3b0234c904a643f6917c2":"daeca6a0fb4e46dbe09a010ea36bd094fd0a07c07a14f9dab909cbd897af96cc","artifact.1943f7a284028216d1eb4bd3":"d2efd21b18bac6169d72001d1c9bd611d95bad874c9dacd75160c722041a24e6","artifact.19c7aa22ee42d1dbe64351e0":"322dfc26ce7e03cecd49651ae3660675e96cd6b30a7d465802c6ce034cdf9162","artifact.1b5442228e77eac6bc7f9ca9":"c99173a66886dac0673966988aa094358fc3b883f3bf84a8d4c5d1298c84f300","artifact.1c66bb9f9abe65aef0499959":"566bbcd5d301405c845c14917e6647d43a3e3a6c7a5ca58144120a68a7eb245d","artifact.1e82e9b458bdb7d3331def5d":"000b13bdd6397b3068c4fb4be4c0eae36f3f7bf24eed2aeff3606a9b88c9e3dc","artifact.1f2a3ea7718d68d6c0882034":"0e23c1bbe713dadaffcc6a054b81a7eac629dfdf2d2da13939c8c21b3bde6009","artifact.20a6a487c92614fe9b6c25eb":"92da06c165a31d0f8c21c28a5feb54653d2626584714789dee65bc0a2d812358","artifact.21cb8b87bdbafce24698953b":"e37a53b017d80d949ad5ef45efc77c7f6f5edccea9397dc3854826ef6060c904","artifact.21ee825ee070dee33e928ef6":"218639963b75459ceccb5c3e1ea36490ffd14b014d869990a6a38b169ec9c182","artifact.2287c09f8ec83a2b1adb1e27":"a68cc8592fc4ad6f7e6bb24b3fdc71e7071467779d8ae9e6d1b6d9624467f92c","artifact.23c33a239de01e7a2d6542d7":"dbbf8fbc915bb8663a6eca1046b088ff3501c1681a853e202e0a30bf7098c86b","artifact.2427d72a92d0cb8428e59959":"b034ef2fb23de55ac34543ac8e80dfc96d42ddddbd3964f75bf69f7930d4b22e","artifact.2599aa1ba730d7549234cfc9":"855bc92fb0e23afc8f4ad637910fe30c1ed9d6be75db8f03ea5787cf8eacc91b","artifact.25a4ce1b3f67b6188484b976":"b97a80ccb42105540b45a4835912efe32a83dc60c4dba925e6c58e08e4b9e5e0","artifact.260907dc9d6167094a71d865":"f8ac2c75e7f629a87565c80d61ff9fe5aa15cdea0bda997d52a4dc13fdbd19cb","artifact.271e0b96b391a73d9f926f93":"c2eecf3e820d0ad7e1b942a766f42b9fd70f1cbc526c26f976dc47c7808c4978","artifact.2a9239afc4ad537cd297acb7":"0bad07b18f564c2e324915efeb82af4b700c2fcad071968ed34919f838b160cf","artifact.2b11df48462c8ff29ea02d0b":"6e1bd69d1208a95f27c0d8e0931aded573035a81fba0d0a7576d4c09cb56838b","artifact.2cb1bf045ee7dad038ec500a":"c95efbfe6484346b55f40537ab10eafd07d99b210460b4d68e9752e94c1cef76","artifact.2eff73c2d13b911cc533bb8a":"e93c8f22ec05c8d5c77b9c304285d5c43156ed6c18c2c07b922b9a1f955fc41e","artifact.2f0689ab9b68775671d70413":"a16d2b53684d5e5794864940b090e76171c8be97d105fdcecd3dbefb37b2bfe6","artifact.30c9c31ba5fb8e12f1f46aae":"6ae5ed68ead99e4068c21d9c39e0a765f1d0b5cdb7cde6b7f2044c9fbf459aeb","artifact.314c5ec5c74b6294872f7126":"9bd8d8d8b075bda64e4c7016f7fa4d85d78b248401ae7ded3f7a164fbfeee1ff","artifact.3269127d8ef1fab2efe60797":"79d08bae03f6bb1e5b97c807d5ceb312074f6fab2cb7c09bdd80018e01b5d9d4","artifact.35c2409bde489118715e4208":"b24654a981c5215b2bd1f11bf45f1ab60d09fc4f5a56bce757c2c510715601e2","artifact.38f59b593026f54ac2c1daec":"b8191c94cb02892d9ba8fa45779992a92af08e9a09a88caedeca1d9a23269fe1","artifact.39520f4ce466143280b84424":"4df9029f865990918b08121d41453825bc7188f913ec5dad0f8f5099b5410715","artifact.39626788a8777217527f7877":"8310fc6f07f9caac5ad59a31f8da886ff82b0f7c1c937dbf992f1e80209b81b8","artifact.39cd417dbf1777637faa6c42":"3f3aca4ade04b88512e878d7b466936fa8749293251c897ecd4ad0330eaa3f9c","artifact.39ff2fceb7d7c7a26266fc78":"27cf764db86c6ea90d23af3451265c52c28d929a16a52c664c432f37bed49a2a","artifact.3c9135ae0a68c1a735110114":"053b97a754a041c7af621d88f0d0527d443001a8023edda4cb8d20f463d23276","artifact.3df0411c6c366943c7dd04e0":"fa795692b4fb7a8a63df82edd98a4649b8352511ca27b4b1ef54f7815fa59d65","artifact.3f500b1a9ba037ad9810682e":"5cfc4e4e4f385f3a6f05a1382eb8915ab8b7d4fb333687fab0e05c774f03ab1e","artifact.432024a51f893d0ae8954df5":"d262be803bc2dddeced976f1da1309afc01da73ce689275eeaff2ce5df0c1c96","artifact.48ddcb7af7c17423357ddfb5":"5716c42bab960ba977b765f1aa3f82aa1b4fdd7d8b2d296bcd073d2261b0843e","artifact.4948f827a405a94915a08db0":"a7017362bfd6b37575ca2b41d54257f061aed2e7dbc36cd12a2b455ff0c48162","artifact.4a3eb561939c71f43912f24c":"a9afacbf83b49b652cbe859457fc63063901974dbabe4a0dea60507435e5140b","artifact.4b896e2c0d03d6a07d7aa0ff":"1cc95d0b3ebaffc30ba80c7565923efccdc184d827c3c82952ca23be736c3bc8","artifact.4d0fd17d9aab0d5b642e3c04":"1bea0de4c4e1935adec0f258dccea19691af8cf3f1b76e9aa9a9b85020f43194","artifact.4e0a30c849538dda18d369ab":"70a7e964ae221ecac0c8c6ffb4ae4d4d3a6ae8b5306562aef2e2d6b90dde4938","artifact.4e29ab92a95273f27a3e9760":"b5f9e676b9dbb4a37e1e593940bc02a7b0c5d88b48c29d408bc9a1bcef9c3133","artifact.4e2f4657a78683e79827e179":"9469e5e9f5e3fbcd971241b030de8dc22a76f3731ff2be1c7f0641a5935007fa","artifact.50bfb56447ea638e13b39ef1":"ffdbedf5ca5c5f5ba8383b336fca65b2b4ced22756497a7ae4c81508ccdc7307","artifact.5106b4a42ce0d1c49253afa3":"1d0b9b2b037197bd63cb25f6b923dbe0252ab264d5bb9456fa22720daa2c1132","artifact.52327ca2fe6488102f1a0b78":"1c95481abe9cdf5dd548e2819b5630ae61b91d96f501f355fb92590c516a40f4","artifact.525acbb4ecb691c5b4ea4d34":"af314ede05c901afde408aec967568b1b825040fbce07c0ebb5a878f9b17edd3","artifact.541cca1d5d4bbbf8dcd9b25f":"3b0860cb23e8d4a759fb83b1bbac5cb84994c4528eca6e3fdd169e3253dedb5e","artifact.553cb5f47d6102c60a4e7f60":"99153a1788ad06ce69f58a566c51370f984abade2dc9eac7574c814c6ea63fa5","artifact.572a7135f8e63f3bdb90e40f":"c38aa8a9079ddec12980417b3109d6058d85ee19dd916b21b9263718291dadcf","artifact.57f7e020f381136a386ef935":"1217042604881174607e93d4b2e3d6aa22d531f5105bca95392675cd7d18858e","artifact.5838b82851f38ccfcdfb2d9b":"18121c4c6f698b9e126fda98da6076de9d2fa369e2d20efb84ffa6d8fc0cbef8","artifact.5afe173c85030c90624725ab":"b93e2186f95425af863ce8f147585e00227c375b0186e0fd9d90a2737f3810e2","artifact.5cf4a9cc93d90cc902defdc7":"940be5292a3e6365674257373ea5305ad6ba16ecafc445d0aa4beb654f24cc71","artifact.5db633d3a41cd212c63f6da9":"6b78c9368be11de0eabb76efca6dce3f89df3b749acc85775afe779112274b2b","artifact.5f4da6839b181694869a1f82":"f0f67c2ad39b5ed8f9060c4a7b61c4a8db1cec87c436b324aaaec1c363962f44","artifact.5f8951234eaab82aac6a7103":"5045f19b67a1659ab1ddd7906f2dbf2bb2edb65336393abc29a4695265318a00","artifact.5fa5617d28599a9c9be8245f":"3303e1e77e770014887d016d059e8c885add3709571252c25a97380edce4cd95","artifact.606e7d6840f29277cbd97e8c":"5952105db481f0e793caedd5c5668069a0af8ecd198b2539d19b17c18b47640e","artifact.61a05bacea6f398f958c74b6":"e2c5c3db9eabd31b216b42b28fe70d49a3c8ddca4525bcd86a93164ca1f9d608","artifact.629a28c1102d44966f17c5c3":"d3978cc8e3c079a858032bbfcf083096f89258f77ed52ba5ac9ea3e4b17d4809","artifact.639321eddd9fbc347440f453":"d2ab85024a4332a7f61e1b7fd807d39df2488ff6e97593d3b45ffc2d0d5f8675","artifact.657e784a4ca51cf490029e4f":"055127e6c8179ec708c4b3bc36ba653f9a830db9573632b5e428ac92ea232269","artifact.6692886e460ccb8b1274a0ef":"2f23507e68a2a3d270963073f26a420fadacadc1a93fe871f58142c2c44b8993","artifact.68b5138ccf643a2eaed7f75f":"43bb5318dd0c8534edc05106284b1d8026e21faa0fb1262fc4a86542b0ecea80","artifact.6ab599879545d91cc3c19d6e":"748e57620e2d70c9fab437cedeffb2d04f57050e92dd25a32f77fad7cef062ba","artifact.6c4da9381e08c1588420fbc8":"a42be9dc2601775841eacc182f63c9c0519cbec8307bd3ea479c9b9011ae0f90","artifact.6cbedb423b450ad557ee63b0":"f6f91264bb2f68c8108f3f2a7197cc38f3694bab48cbddebd349ec89c85a82eb","artifact.6d5e751096508453ff420938":"f389763a65da7984014d3007c6c63e26a4a3a28121ceddc7ff01b475b4a9c63d","artifact.6e13db7dbcae58e3a9248acb":"6635c0e0c67a7209f45a060527c44a77297602ae83beae98e45c78f90a1b63e3","artifact.6ff006f489fd11ab541ab464":"0ca973ce0e24c4dce40e78187da5f6a5287b587ad775b9ae92cdc89cd235b017","artifact.70617aa555a6fee0305cb9cf":"d16020785f9ad8748fbb240aedcfbbe325bf6a843578e415b5a7ba3b0972814d","artifact.729a39dec570a979121b1aca":"a073f23d7d9c95c8729fd5d9d6f4023ed625372de12690926597ea653ad0e3de","artifact.735b3660048b12efdbbfff82":"5c537d6853e005298a285d508cff9ac7192cea23576c840d485b2b586a7ff177","artifact.73cbbbee94dc689bff0b4b1c":"04e955f71900a1557342ed9f1da261e45fd5760ac774bcc653d5abf0660d13bb","artifact.7445d7bc0a12e224db4a38ae":"8b517e3ed183a3ee57fe9c4ea5d3e2d7e90027351c7bc91aaee9963c53901e63","artifact.75077d4b5b7caa5adc505479":"cb84ae8fc116e2721d0e1b1d82396c8b898c5364ddb98faf47434ddc22048088","artifact.7834f0c8d736d059189e4d03":"5c8895cd803e64abdde1d1bbdcb73498d9200b0b35590c22176fd86ac38b9e84","artifact.78fd1e4b93828968c843281f":"7eb4771401eb2c4ef6b6ffc454ab87337dffd2d9fca846cd26b52f